review_text,review_date,review_title,review_stars,review_flavor
Would love to be a sponsor lolOver all great toolSize like a phone fits in your pocketIn my photo you can see the engine I scannedHas two missing cylinderWould like to try other products from FLIRThanks FLIR,Recensito in Canada il 25 ottobre 2021,Awesome for mechanic to look inside an engine,"5,0 su 5 stelle",Recensito in Canada il 25 ottobre 2021
"DO NOT BUY THIS CRAP! I am not a pro plumber, by all means, but handled hundreds of cameras so far (pro cameras). I've bought the flir in order to save some money finding a leak in my house and for some future use on occasions. I've used it about ten times for a short while and it literally froze twice, the second time happened when I really needed it to check on a leak that was coming from the roof and it froze on me, when this thing happens basically I have to wait until the battery totally get discharged which takes a few hours, and basically kills your day. Just to think of a professional who takes it to work and this Expensive Useless Tool Freezes on him 20% of the time. Add to it the website that is so unfriendly to users, and the first time when it happened to me, I was in Israel checking the property and this thing just froze, I've called the flir representative/the only importer for advice and help and they flatly send me back to seek for help from the people I've bought it from. There is seven hours difference between the U.S. and Israel and the cost of a call by itself is very expensive. I understand that most users will use it in the U.S. only, but if you are willing to take a chance to be out of your camera one time out of five while on the road working and basically have an EXPENSIVE USELESS ROCK THAT YOU WERE COUNTING ON. Go ahead and throw your money into the garbage. Based on my bad experiences, I'll be looking for something else! I hope that this will help you with your decision.",Recensito negli Stati Uniti il 31 dicembre 2020,Unreliable Expensive Piece of Garbage!,"1,0 su 5 stelle",Recensito negli Stati Uniti il 31 dicembre 2020
初めはよかったのですが、2ヶ月でﾋﾟﾝﾄが合わない様になってしまいました。こんな時のための「国内正規品」ですよね、修理に出したいと思います。,Recensito in Giappone il 8 agosto 2022,ﾋﾟﾝﾄが合わないよこれは,"2,0 su 5 stelle",Recensito in Giappone il 8 agosto 2022
Easy to use,Recensito nel Regno Unito il 4 aprile 2021,Excellent purchase,"5,0 su 5 stelle",Recensito nel Regno Unito il 4 aprile 2021
Wie angeboten. super camera.,Recensito in Germania il 15 settembre 2021,IR-Camera,"5,0 su 5 stelle",Recensito in Germania il 15 settembre 2021
